{
  "$schema": "https://json-schema.org/draft/2020-12/schema",
  "type": "object",
  "properties": {
    "$schema": {
      "type": "string"
    },
    "name": {
      "type": "string",
      "pattern": "^[a-z][a-z0-9-]*$",
      "description": "Unique kebab-case identifier."
    },
    "title": {
      "type": "string",
      "minLength": 1
    },
    "description": {
      "type": "string",
      "minLength": 1,
      "maxLength": 200
    },
    "fonts": {
      "type": "object",
      "properties": {
        "body": {
          "anyOf": [
            {
              "type": "string"
            },
            {
              "type": "object",
              "properties": {
                "family": {
                  "type": "string"
                },
                "weight": {
                  "type": "array",
                  "items": {
                    "type": "string"
                  }
                }
              },
              "required": ["family"]
            }
          ]
        },
        "display": {
          "anyOf": [
            {
              "type": "string"
            },
            {
              "type": "object",
              "properties": {
                "family": {
                  "type": "string"
                },
                "weight": {
                  "type": "array",
                  "items": {
                    "type": "string"
                  }
                }
              },
              "required": ["family"]
            }
          ]
        },
        "mono": {
          "anyOf": [
            {
              "type": "string"
            },
            {
              "type": "object",
              "properties": {
                "family": {
                  "type": "string"
                },
                "weight": {
                  "type": "array",
                  "items": {
                    "type": "string"
                  }
                }
              },
              "required": ["family"]
            }
          ]
        }
      }
    }
  },
  "required": ["name", "title", "description"]
}
